{"assembly":{"command_policy_id":"r11.9.godot.capture.v1","digest":"fb2952dec857d46c73caa17fd2673b33d8f7db270cfe4df87c430f636e7fb053","sequence_id":"r11.9.synthetic.sequence"},"blockers":[],"capture":{"audio_channels":2,"audio_duration_seconds":3.0,"audio_sample_rate_hz":48000,"av_sync_error_seconds":0.0,"av_sync_limit_seconds":0.07666666666666666,"expected_duration_seconds":3.0,"expected_frames":90,"format_duration_seconds":3.0,"fps":30,"height":360,"output_bytes":1021734,"output_sha256":"2f383635f2ee94def1ee832ffd742f0fc2cf41af18ef939078f72746e6e8a194","reported_frames":90,"status":"pass","video_duration_seconds":3.0,"width":640},"error_type":null,"evidence_digest":"6afe45e3c9047cfa58b7c617ff671e34e166bd9189a32ea62f1350243955b6f5","fixture":{"file_sha256":{"assembly.json":"384815cdfa94668ca551624015fa0eef0baf41245e4b92cc0d2c67f9eed251a2","capture.gd":"3857b8d18348e30c7e823856ff73e106d770bc161d0b23e1677359eab69e1fd5","capture.tscn":"dbf6d21ec4e17f8165257b9c63934691752cac4234febfdff84bf2e26e51a5ae","project.godot":"e64df3c52d31deea6a5a3a09d83d3fe7d284fd4a909ceabe8bd9418656855c73","tone.wav":"047b1640aef3426cbd4b75098f2e606836ffba6a125418b465bd5fd5e0bbece6"},"kind":"repository_synthetic"},"runtime":{"ffprobe":{"name":"ffprobe.exe","sha256":"a6618e99bb58869ded3c6f37b53aa1a8d701c3591dbb7b5b317d47369c112be2","version":"8.1.1-full_build-www.gyan.dev"},"godot_compatible_47":true,"godot_name":"godot.windows.opt.tools.64.exe","godot_sha256":"12310c74bdda7dcd43f28e971f33047dcecadd436b68169d61ce41009006df38","godot_version":"4.7.2.stable.steam.ed1daf0bf","platform":"Windows"},"schema":"kodepoia.r11_9_local_acceptance","source_sha":"087eae19ea03dd544d75a08c1eb348fe187624c5","status":"pass","version":1}
